{
  "$schema": "https://json-schema.org/draft/2020-12/schema",
  "$id": "contracts/technical_indicator_snapshot.v1.json",
  "title": "TechnicalIndicatorSnapshotV1",
  "type": "object",
  "required": [
    "indicator_snapshot_id",
    "contract_id",
    "instrument_id",
    "timeframe",
    "ts",
    "indicator_set_version",
    "source_bar_fingerprint",
    "close",
    "volume",
    "atr_14",
    "natr_14",
    "ema_12",
    "ema_26",
    "sma_20",
    "sma_50",
    "rsi_14",
    "macd",
    "macd_signal",
    "macd_hist",
    "bb_lower",
    "bb_mid",
    "bb_upper",
    "bb_width",
    "bb_percent_b",
    "adx_14",
    "dmp_14",
    "dmn_14",
    "stoch_k",
    "stoch_d",
    "cci_20",
    "willr_14",
    "mom_10",
    "roc_10",
    "obv",
    "mfi_14",
    "donchian_low_20",
    "donchian_mid_20",
    "donchian_high_20",
    "supertrend",
    "supertrend_direction",
    "rvol_20",
    "computed_at_utc",
    "indicator_values_json"
  ],
  "properties": {
    "indicator_snapshot_id": {"type": "string", "minLength": 1},
    "contract_id": {"type": "string", "minLength": 1},
    "instrument_id": {"type": "string", "minLength": 1},
    "timeframe": {"type": "string", "enum": ["1m", "5m", "15m", "1h", "4h", "1d", "1w"]},
    "ts": {"type": "string", "minLength": 1},
    "indicator_set_version": {"type": "string", "minLength": 1},
    "source_bar_fingerprint": {"type": "string", "minLength": 1},
    "close": {"type": "number"},
    "volume": {"type": "number", "minimum": 0},
    "atr_14": {"type": "number", "minimum": 0},
    "natr_14": {"type": "number", "minimum": 0},
    "ema_12": {"type": "number"},
    "ema_26": {"type": "number"},
    "sma_20": {"type": "number"},
    "sma_50": {"type": "number"},
    "rsi_14": {"type": "number"},
    "macd": {"type": "number"},
    "macd_signal": {"type": "number"},
    "macd_hist": {"type": "number"},
    "bb_lower": {"type": "number"},
    "bb_mid": {"type": "number"},
    "bb_upper": {"type": "number"},
    "bb_width": {"type": "number", "minimum": 0},
    "bb_percent_b": {"type": "number"},
    "adx_14": {"type": "number"},
    "dmp_14": {"type": "number"},
    "dmn_14": {"type": "number"},
    "stoch_k": {"type": "number"},
    "stoch_d": {"type": "number"},
    "cci_20": {"type": "number"},
    "willr_14": {"type": "number"},
    "mom_10": {"type": "number"},
    "roc_10": {"type": "number"},
    "obv": {"type": "number"},
    "mfi_14": {"type": "number"},
    "donchian_low_20": {"type": "number"},
    "donchian_mid_20": {"type": "number"},
    "donchian_high_20": {"type": "number"},
    "supertrend": {"type": "number"},
    "supertrend_direction": {"type": "number"},
    "rvol_20": {"type": "number", "minimum": 0},
    "computed_at_utc": {"type": "string", "minLength": 1},
    "indicator_values_json": {
      "type": "object",
      "additionalProperties": {
        "type": ["number", "string", "boolean", "null"]
      }
    }
  },
  "additionalProperties": false
}
