{
  "indicator_snapshot_id": "IND-6A2E00111ABC",
  "contract_id": "BR-9.26",
  "instrument_id": "BR",
  "timeframe": "1d",
  "ts": "2026-03-16T00:00:00Z",
  "indicator_set_version": "pandas-ta-v1",
  "source_bar_fingerprint": "BAR-6A2E00111ABC0001",
  "close": 83.3,
  "volume": 15230,
  "atr_14": 1.52,
  "natr_14": 1.82,
  "ema_12": 83.15,
  "ema_26": 82.47,
  "sma_20": 82.9,
  "sma_50": 81.7,
  "rsi_14": 58.4,
  "macd": 0.34,
  "macd_signal": 0.21,
  "macd_hist": 0.13,
  "bb_lower": 80.4,
  "bb_mid": 82.9,
  "bb_upper": 85.4,
  "bb_width": 6.03,
  "bb_percent_b": 0.58,
  "adx_14": 22.5,
  "dmp_14": 25.1,
  "dmn_14": 16.2,
  "stoch_k": 63.2,
  "stoch_d": 60.1,
  "cci_20": 74.5,
  "willr_14": -31.4,
  "mom_10": 1.2,
  "roc_10": 1.46,
  "obv": 532000,
  "mfi_14": 55.7,
  "donchian_low_20": 81.6,
  "donchian_mid_20": 82.9,
  "donchian_high_20": 84.2,
  "supertrend": 80.8,
  "supertrend_direction": 1,
  "rvol_20": 1.18,
  "computed_at_utc": "2026-03-16T00:05:00Z",
  "indicator_values_json": {
    "source": "pandas-ta-classic",
    "rsi_14": 58.4,
    "macd_hist": 0.13
  }
}
